{
  "decision": "include",
  "lane": "featured-event",
  "category": null,
  "confidence": 0.88,
  "reasons": [
    "(a) in coming week: starts 2026-09-08, issue date 2026-09-04",
    "(b) audience relevance: CBS, NYC-anchored builder sitting",
    "(c) major AI sponsor/host: OpenAI named as host; not invented"
  ],
  "matchedKeywords": ["openai", "nyc", "columbia", "sitting"],
  "failedChecks": [],
  "draft": {
    "slug": "openai-nyc-builder-sitting",
    "title": "OpenAI NYC builder sitting",
    "summary": "OpenAI hosts a builder sitting at Columbia Business School. Host page on Luma.",
    "startsAt": "2026-09-08T18:00:00-04:00",
    "location": "Columbia Business School, Manhattan",
    "href": "https://luma.com/example-openai-nyc",
    "inferred": false,
    "featured": true
  }
}
