{
  "decision": "include",
  "lane": "industry",
  "category": "release",
  "confidence": 0.92,
  "reasons": [
    "Flagship GPT-5.6 family GA on OpenAI primary",
    "Clears CRITERIA release bar; source gate is company primary"
  ],
  "matchedKeywords": ["launches", "gpt-", "generally available"],
  "failedChecks": [],
  "draft": {
    "slug": "gpt-5-6",
    "title": "OpenAI launches GPT-5.6 (Sol / Terra / Luna)",
    "summary": "OpenAI made the GPT-5.6 family generally available on 9 July, as Sol, Terra, and Luna. The company posted the launch on openai.com.",
    "publishedAt": "2026-07-09",
    "href": "https://openai.com/index/gpt-5-6/",
    "inferred": false,
    "held": false,
    "lane": "industry",
    "category": "release"
  }
}
